{
  "id": 0,
  "openWidgetIndex": -1,
  "name": "Scrape product cards to a sheet",
  "templateId": 0,
  "triggers": [],
  "share_status": false,
  "share_link": "",
  "stored_cookies": [],
  "data": {
    "allowConcurrencyDesktop": true,
    "builderTemplateId": 0,
    "context": [{"context": "url", "url": "https://example.com/products"}],
    "disallowConcurrencyCloud": false,
    "form": [
      {
        "machine_name": "WidgetDriverGoto",
        "name": "Go to page",
        "stepNumber": "1",
        "params": [
          {
            "collapsible": 0,
            "configurable": true,
            "name": "URL",
            "type": "token",
            "value": "https://example.com/products"
          }
        ]
      },
      {
        "machine_name": "WidgetDriverSmartScraper",
        "name": "Get data",
        "stepNumber": "2",
        "params": [
          {
            "collapsible": 0,
            "configurable": true,
            "name": "Selector",
            "type": "smart_selector",
            "value": ".product-card"
          },
          {
            "collapsible": 0,
            "configurable": true,
            "name": "Max results",
            "type": "scraper_max_results",
            "value": "50"
          }
        ]
      },
      {
        "machine_name": "WidgetWriteGoogleSheet",
        "name": "Write to sheet",
        "stepNumber": "3",
        "params": [
          {
            "collapsible": 0,
            "configurable": true,
            "name": "Spreadsheet",
            "type": "spreadsheet_picker",
            "value": ""
          },
          {
            "collapsible": 0,
            "configurable": true,
            "name": "Sheet",
            "type": "sheet_name_dropdown",
            "value": ""
          }
        ]
      }
    ],
    "headless": false,
    "incognitoMode": false,
    "injector": {"injector": "dom", "magic_btn_status": true, "selector": ""},
    "mode": "browser",
    "storeCookies": false,
    "templateId": 0,
    "templateItem": {"name": "Scrape product cards to a sheet", "description": "Three-step pattern: navigate, scrape, write."},
    "templateMode": false,
    "templateStarted": false,
    "tokens": null,
    "viewport": null
  }
}
