{
  "id": 0,
  "openWidgetIndex": -1,
  "name": "Scrape axiom",
  "templateId": 0,
  "triggers": [],
  "share_status": false,
  "share_link": "",
  "stored_cookies": [],
  "data": {
    "allowConcurrencyDesktop": true,
    "builderTemplateId": 0,
    "context": [
      {
        "context": "url",
        "url": "https://axiom.ai"
      }
    ],
    "disallowConcurrencyCloud": false,
    "form": [
      {
        "description": "Instruct the bot to go to a new page.",
        "hasErrors": false,
        "machine_name": "WidgetDriverGoto",
        "metadata": "",
        "name": "Go to page",
        "original_name": "Go to page",
        "params": [
          {
            "collapsible": 0,
            "configurable": true,
            "default_value": "",
            "description": [
              "Enter a URL to go to. You can also plugin data from other steps to provide a URL. Enter (skip) to skip this step."
            ],
            "help": [],
            "image": "",
            "name": "Enter URL",
            "type": "current_url",
            "value": "https://axiom.ai"
          },
          {
            "collapsible": 0,
            "configurable": false,
            "default_value": false,
            "description": [
              "Cookie detected, store if running in the cloud and you wish to run your automation using the scheduler or the API."
            ],
            "help": [
              {
                "name": "Learn ",
                "linkSrc": "https://axiom.ai/docs/tutorials/settings/run-options/store-cookies",
                "linkText": "more"
              }
            ],
            "image": "",
            "name": "Store Cookie",
            "type": "store_cookie",
            "value": false
          },
          {
            "collapsible": 1,
            "configurable": true,
            "default_value": false,
            "description": [
              "Check the box to stop Axiom retrieving session data from this URL's localstorage. This will prevent an extra page refresh but can prevent your session from loading fully."
            ],
            "help": [],
            "image": "",
            "name": "Do not share localstorage",
            "type": "special_character",
            "value": false
          },
          {
            "collapsible": 1,
            "configurable": true,
            "default_value": false,
            "description": [
              "Check the box to open the URL in a new browser tab, the automation will automatically switch to running in the new tab."
            ],
            "help": [],
            "image": "",
            "name": "Open in new tab",
            "type": "special_character",
            "value": false
          }
        ],
        "stepNumber": "1",
        "token": ""
      },
      {
        "description": "Scrape data from the page the bot is currently on.",
        "hasErrors": false,
        "machine_name": "WidgetDriverSmartScraper",
        "metadata": "",
        "name": "Get data from bot's current page",
        "original_name": "Get data from bot's current page",
        "params": [
          {
            "collapsible": 0,
            "configurable": false,
            "default_value": "",
            "description": [
              "Choose the data you wish to scrape."
            ],
            "help": [],
            "image": "h-scrape-data",
            "name": "Select",
            "type": "smart_selector",
            "value": ""
          },
          {
            "collapsible": 0,
            "configurable": false,
            "default_value": "",
            "description": [
              "Select the 'Next' button for the pager, if there is one. When running the bot, please select 'Use element text' if it stops paging after the first page."
            ],
            "help": [],
            "image": "h-pager",
            "name": "Find pager",
            "type": "selector_single",
            "value": ""
          },
          {
            "collapsible": 0,
            "configurable": true,
            "default_value": "1",
            "description": [
              "Set a maximum number of results you wish to scrape. Setting this number higher than the number of results you need will slow down the scraper - axiom has to spend time looking for results that it will never find."
            ],
            "help": [],
            "image": "",
            "name": "Max results",
            "type": "scraper_max_results",
            "value": "1"
          },
          {
            "collapsible": 1,
            "configurable": true,
            "default_value": {
              "scrollSpeed": 5000,
              "maxAttempts": 2
            },
            "description": [],
            "help": [],
            "image": "",
            "name": "Configure scraper",
            "type": "scraper_settings",
            "value": {
              "scrollSpeed": 5000,
              "maxAttempts": 2
            }
          }
        ],
        "stepNumber": "2",
        "token": "scrape-data"
      }
    ],
    "headless": false,
    "incognitoMode": false,
    "injector": {
      "injector": "dom",
      "magic_btn_status": true,
      "selector": ""
    },
    "mode": "browser",
    "storeCookies": false,
    "templateId": 0,
    "templateItem": {
      "name": "Scrape axiom",
      "description": ""
    },
    "templateMode": false,
    "templateStarted": false,
    "tokens": null,
    "viewport": null
  }
}
